### ISSUE TITLE
HAP AC3 Does not properly extend Network DHCP Address when expanding from /28(13hosts) to /27(29hosts)

### ISSUE THREAD

**Issue by aa3jc** [aredn/aredn#2650]
Originally, about a year ago,  I had setup my AC3’s Network settings for /28(13hosts), but 2 days ago I changed it to /27(29hosts). As expected, the network Mesh address along with the LAN address, and DHCP range followed the new IP scheme and assigned the range to follow with 29 DHCP Addresses, again as expected.  

Currently running the latest nightly firmware version:  20260303-6030f5e9
 
Now, only 10 DHCP address will assign, and even though it shows the full 29 addresses, it will not assign 2 of the original devices connected, nor anything else new. Only 8 addresses are being assigned.  The other two show connection and activity, but will not showup in the "Local" or can be accessed via any of the remaining DHCP addresses.  Any new devices added show no connection via ethernet, yet if I remove the ethernet from the HAP and connect it to my main router within seconds the lan device receives a DHCP address and is accessable via that address.  

I attempted to reset the DHCP to assign /28(13hosts) and after a reboot only 10 devices (same as above) would work correctly, and the original two displayed the same behavior as above.

Support Data and screen shots attached!

[supportdata-AA3JC-AC3-HTFLD-LAN-2026-3-19-15-20.tar.gz](https://github.com/user-attachments/files/26129928/supportdata-AA3JC-AC3-HTFLD-LAN-2026-3-19-15-20.tar.gz)

[AA3JC-AC3-HTFLD-LAN-Main Status Page.pdf](https://github.com/user-attachments/files/26129949/AA3JC-AC3-HTFLD-LAN-Main.Status.Page.pdf)

[AA3JC-AC3-HTFLD-LAN-DHCP Page.pdf](https://github.com/user-attachments/files/26129962/AA3JC-AC3-HTFLD-LAN-DHCP.Page.pdf)

**Comment by aanon4** [comment]
Looking at the DHCP configuration, this is the relevant configuration line for 'dnsmasq':
```
dhcp-range=set:lan,10.233.186.226,10.233.186.254,255.255.255.224,1h
```
which looks to be correct unless I'm missing something. It would be interesting to see a copy of `/tmp/dhcp.leases` from this node - it's not part of the support data.

**Comment by aanon4** [comment]
I notice that the IP address of the mesh is 10.55.92.1, which is the same as the IP address of the LAN 10.55.92.1 - not sure why, but not a good thing. The mesh address is the easiest to change from the UI. Try making it 10.54.92.1 (for example).

**Comment by aa3jc** [comment]
Change made.  I left it that way after my testing as it didn't make any diffrence either way!

<img width="1886" height="835" alt="Image" src="https://github.com/user-attachments/assets/270fd155-1aeb-4ffb-8e25-4de9b70f29de" />

**Comment by aanon4** [comment]
At this point perhaps you can email me a password to this node - might be easier.

**Comment by aa3jc** [comment]
Tim,

Password for:   http://aa3jc-ac3-htfld-lan.local.mesh/a/status   password:  12345!

Joe


Joe Caltabiano-AA3JC
PEMA-ACS Eastern Area Section Chief
________________________________________________
Joe Caltabiano AA3JC ComL, ComT, Auxcom, ACS
Eastern Area PEMA-ACS Section Chief
215-237-7991 (cell)
MCAR Mesh IP Phone: 215-3103
PEMA-ACS Mesh IP Phone: 215-2001
HOIP: 100294
Amateurwire:  2233
***@***.***
***@***.***
***@***.***

Apr 20, 2026 7:45:42 PM Tim Wilkinson ***@***.***>:

**Comment by aanon4** [comment]
Thanks.
The next step is to point me at a device which should be getting a DHCP assignment but isn't. I need to monitor for its attempting to associate. As much as you can tell me about it is appreciated, but I absolutely need its MAC address at a minimum.

**Comment by aanon4** [comment]
This is the tcpdump looking at DHCP requests on the LAN network. It only sees the one's it currently has leases for. Did you disable the others?
```
root@AA3JC-AC3-HTFLD-LAN-1:~# tcpdump -i br-lan port 67
tcpdump: verbose output suppressed, use -v[v]... for full protocol decode
listening on br-lan, link-type EN10MB (Ethernet), snapshot length 262144 bytes
15:37:47.282142 IP PEMA-ACS-EAST-AA3JC-PBX-1.68 > localnode.67: BOOTP/DHCP, Request from 10.55.92.8, length 300
15:37:47.284040 IP localnode.67 > PEMA-ACS-EAST-AA3JC-PBX-1.68: BOOTP/DHCP, Reply, length 366
15:41:19.840736 IP AA3JC-WEBSERVER.68 > localnode.67: BOOTP/DHCP, Request from 10.55.92.4, length 293
15:41:19.842829 IP localnode.67 > AA3JC-WEBSERVER.68: BOOTP/DHCP, Reply, length 377
15:52:08.124770 IP AA3JC-FLIGHTAWARE.68 > localnode.67: BOOTP/DHCP, Request from 10.55.92.11, length 295
15:52:08.126797 IP localnode.67 > AA3JC-FLIGHTAWARE.68: BOOTP/DHCP, Reply, length 379
15:53:11.611101 IP AA3JC-Winlink-PostOffice.68 > localnode.67: BOOTP/DHCP, Request from 10.55.92.6, length 334
15:53:11.613033 IP localnode.67 > AA3JC-Winlink-PostOffice.68: BOOTP/DHCP, Reply, length 400
16:00:47.913256 IP TL-SG108E-SWITCH2.68 > localnode.67: BOOTP/DHCP, Request from 10.55.92.10, length 287
16:00:47.915150 IP localnode.67 > TL-SG108E-SWITCH2.68: BOOTP/DHCP, Reply, length 300
16:01:08.598029 IP TL-SG108E-1.68 > localnode.67: BOOTP/DHCP, Request from 10.55.92.7, length 281
16:01:08.599966 IP localnode.67 > TL-SG108E-1.68: BOOTP/DHCP, Reply, length 300
16:03:11.279321 IP PEMA-ACS-EAST-AA3JC-PBX-1.68 > localnode.67: BOOTP/DHCP, Request from 10.55.92.8, length 300
16:03:11.281241 IP localnode.67 > PEMA-ACS-EAST-AA3JC-PBX-1.68: BOOTP/DHCP, Reply, length 366
16:08:24.830407 IP AA3JC-WEBSERVER.68 > localnode.67: BOOTP/DHCP, Request from 10.55.92.4, length 293
16:08:24.832423 IP localnode.67 > AA3JC-WEBSERVER.68: BOOTP/DHCP, Reply, length 377
16:20:06.114179 IP AA3JC-FLIGHTAWARE.68 > localnode.67: BOOTP/DHCP, Request from 10.55.92.11, length 295
16:20:06.116131 IP localnode.67 > AA3JC-FLIGHTAWARE.68: BOOTP/DHCP, Reply, length 379
16:21:12.708934 IP AA3JC-Winlink-PostOffice.68 > localnode.67: BOOTP/DHCP, Request from 10.55.92.6, length 334
16:21:12.710865 IP localnode.67 > AA3JC-Winlink-PostOffice.68: BOOTP/DHCP, Reply, length 400
16:25:15.091793 IP PEMA-ACS-EAST-AA3JC-PBX-1.68 > localnode.67: BOOTP/DHCP, Request from 10.55.92.8, length 300
16:25:15.093743 IP localnode.67 > PEMA-ACS-EAST-AA3JC-PBX-1.68: BOOTP/DHCP, Reply, length 366
16:30:49.229043 IP TL-SG108E-SWITCH2.68 > localnode.67: BOOTP/DHCP, Request from 10.55.92.10, length 287
16:30:49.230950 IP localnode.67 > TL-SG108E-SWITCH2.68: BOOTP/DHCP, Reply, length 300
16:31:09.904217 IP TL-SG108E-1.68 > localnode.67: BOOTP/DHCP, Request from 10.55.92.7, length 281
16:31:09.906115 IP localnode.67 > TL-SG108E-1.68: BOOTP/DHCP, Reply, length 300
16:36:31.818161 IP AA3JC-WEBSERVER.68 > localnode.67: BOOTP/DHCP, Request from 10.55.92.4, length 293
16:36:31.820283 IP localnode.67 > AA3JC-WEBSERVER.68: BOOTP/DHCP, Reply, length 377
16:47:01.101038 IP AA3JC-FLIGHTAWARE.68 > localnode.67: BOOTP/DHCP, Request from 10.55.92.11, length 295
16:47:01.103020 IP localnode.67 > AA3JC-FLIGHTAWARE.68: BOOTP/DHCP, Reply, length 379
16:47:44.806095 IP AA3JC-Winlink-PostOffice.68 > localnode.67: BOOTP/DHCP, Request from 10.55.92.6, length 334
16:47:44.808095 IP localnode.67 > AA3JC-Winlink-PostOffice.68: BOOTP/DHCP, Reply, length 400
```

**Comment by aa3jc** [comment]
Sorry it took till now to move 5 more Lan devices over to AA3JC-AC3-HTFLD-LAN-1.

**Comment by aanon4** [comment]
Okay. So there were 6 devices before, you added 5 new ones, and your node is currently issuing 11 leases which is what you'd expect. Is there a specific device that doesnt seem to work I can look at?

**Comment by aa3jc** [comment]
Before node would not assign more than 10 devices even thought DHCP was set for 13. Changed to 29 and 5 that were assign never got a DHCP address, even after the node was set back to 13.  If you like I can drop a few more devices on the dumb switch.

Joe


Joe Caltabiano-AA3JC
PEMA-ACS Eastern Area Section Chief
________________________________________________
Joe Caltabiano AA3JC ComL, ComT, Auxcom, ACS
Eastern Area PEMA-ACS Section Chief
215-237-7991 (cell)
MCAR Mesh IP Phone: 215-3103
PEMA-ACS Mesh IP Phone: 215-2001
HOIP: 100294
Amateurwire:  2233
***@***.***
***@***.***
***@***.***

May 7, 2026 5:39:18 PM Tim Wilkinson ***@***.***>:

**Comment by aanon4** [comment]
I just need one that doesnt work as so far everything looks good.

**Comment by aanon4** [comment]
What's the status of this problem?
